序號,國別地區,中文片名,上映日期,申請人,出品,上映院數,銷售票數,週票數變動率,銷售金額,累計銷售票數,累計銷售金額
1,中華民國,哈勇家,2022/11/11,華映娛樂股份有限公司,"華映娛樂股份有限公司,氧氣電影有限公司,中環國際娛樂事業股份有限公司,星泰國際娛樂股份有限公司,得藝文創國際股份有限公司,凡宇興業有限公司,樂到家國際娛樂股份有限公司,鏡文學股份有限公司",80,"13,944",-19.14%,"3,144,771","35,897","7,723,136"
2,中華民國,我心我行,2022/11/11,三乘影像股份有限公司,"三乘影像股份有限公司,藝碩文創股份有限公司,許芳宜＆藝術家",30,"5,733",-10.04%,"1,243,114","14,675","3,093,127"
3,日本,春心萌動的老屋緣廊,2022/11/11,天馬行空數位有限公司,NIPPON TELEVISION NETWORK CORPORATION,18,743,11.23%,"167,710","1,411","323,810"
4,日本,即使，這份戀情今晚會從世上消失,2022/11/11,車庫娛樂股份有限公司,"TOHO CO., LTD.",54,"8,996",16.30%,"2,237,891","16,731","4,146,041"
5,法國,抓狂養老院,2022/11/11,原創娛樂股份有限公司,Other Angle Pictures,5,115,-15.44%,"26,330",251,"58,745"
6,日本,幽靜的山荷葉,2022/11/11,希望行銷娛樂有限公司,"Nagoya Broadcasting Network Co., Ltd.",10,154,-46.90%,"31,535",444,"93,240"
7,澳門,海鷗來過的房間,2022/11/11,海鵬影業有限公司,地地影像工房有限公司,13,457,194.84%,"92,235",612,"125,895"
8,瑞典,星夢性快感,2022/11/11,車庫娛樂股份有限公司,VERSATILE,17,182,18.18%,"40,227",336,"76,568"
9,美國,黑豹 2：瓦干達萬歲,2022/11/09,台灣華特迪士尼股份有限公司,"BUENA VISTA INTERNATIONAL, INC.",97,"263,630",-29.15%,"70,998,681","635,723","171,748,371"
10,西班牙,遺屍物,2022/11/04,原創娛樂股份有限公司,"Castelao Pictures, S.L.U.",4,31,-86.28%,"7,275",680,"163,606"
11,法國,索蘭琪的少女心事,2022/11/04,東昊影業有限公司,ＭＫ2 Films,1,9,-89.02%,"1,870",149,"30,304"
12,美國,絕命線阱,2022/11/04,采昌國際多媒體股份有限公司,GEM ENTERTAINMENT KFT.,16,610,-47.41%,"133,885","3,575","819,026"
13,南韓,局中局,2022/11/04,車庫娛樂股份有限公司,RELAY MOTION KFT.,64,"3,529",-56.26%,"835,938","23,783","5,685,904"
14,日本,迴咒師ー塩子的誕生,2022/11/04,台灣幸福科學出版有限公司,幸福の科学,12,"2,805",-48.62%,"617,578","12,104","2,666,716"
15,日本,大逃殺 4K數位修復版,2022/11/04,車庫娛樂股份有限公司,RELAY MOTION KFT.,13,226,-65.34%,"52,843","1,713","398,996"
16,瑞士,瑞士鐘錶師,2022/11/04,聯影企業股份有限公司,Alpha Violet,4,109,-70.46%,"21,590",950,"200,897"
17,中華民國,小藍,2022/11/04,英屬蓋曼群島商威望國際娛樂股份有限公司台灣分公司,奇葩娛樂事業有限公司,29,"2,768",-54.59%,"583,502","12,023","2,729,697"
18,俄羅斯,獵空計畫,2022/11/04,可樂藝術文創股份有限公司,Central Partnerhsip Sales House LCC,3,19,-91.91%,"3,957",608,"137,990"
19,日本,刀劍神域劇場版 –Progressive- 陰沉薄暮的詼諧曲,2022/11/01,木棉花國際股份有限公司,Aniplex Inc.,79,"17,958",-53.89%,"4,462,951","104,948","25,828,713"
20,日本,天才狂歡派對：首部曲,2022/11/01,光年映畫有限公司,"Beyond C. Co., Ltd.",21,810,0.00%,"203,171",985,"252,171"
21,美國,鬼禱,2022/10/28,車庫娛樂股份有限公司,"FLAMING DEVILS, LLC",40,"1,958",-56.19%,"458,520","32,638","7,889,656"
22,南韓,笑子當老大,2022/10/28,采昌國際多媒體股份有限公司,Atrium Productions Kft.,2,47,-31.88%,"10,330","1,476","333,872"
23,中華民國,罪後真相,2022/10/28,威視股份有限公司,"伯樂影業股份有限公司,中環國際娛樂事業股份有限公司 ,良人行影業有限公司 ,宏將影業有限公司 ,東森電視事業股份有限公司 ,滿滿額娛樂股份有限公司 ,聚星文創娛樂事業股份有限公司 ,打字人創意有限公司 ,得利影視股份有限公司 ,有戲娛樂股份有限公司",78,"7,586",-56.70%,"1,887,345","62,895","14,689,064"
24,中華民國,流麻溝十五號,2022/10/28,牽猴子股份有限公司,湠臺灣電影股份有限公司,85,"25,589",-29.25%,"5,707,458","131,155","29,592,508"
25,日本,信用詐欺師JP：英雄篇,2022/10/28,可樂藝術文創股份有限公司,PONY CANYON INC.,5,102,-74.24%,"24,750","3,531","834,944"
26,日本,流浪之月,2022/10/28,車庫娛樂股份有限公司,RELAY MOTION KFT.,1,23,-80.00%,"5,695","1,538","369,400"
27,中華民國,大俠胡金銓 第二部曲—斷腸人在天涯,2022/10/28,華映娛樂股份有限公司,"華映娛樂股份有限公司,七霞電影有限公司",12,147,-88.26%,"32,195","5,058","1,019,171"
28,挪威,詭孩,2022/10/28,好威映象有限公司,Atrium Productions KFT.,1,29,-67.78%,"6,260","1,031","246,306"
29,日本,劇場版 超時空要塞F~戀離飛翼~,2022/10/21,水元素文化傳媒有限公司,"BIGWEST CO., LTD.",4,131,718.75%,"29,795","3,324","835,671"
30,日本,犬王,2022/10/21,車庫娛樂股份有限公司,RELAY MOTION KFT.,7,417,-44.03%,"102,598","9,702","2,409,212"
31,中華民國,大俠胡金銓 第一部曲—先知曾經來過,2022/10/21,華映娛樂股份有限公司,"華映娛樂股份有限公司,七霞電影有限公司",9,70,-95.11%,"15,420","5,797","1,216,682"
32,俄羅斯,大尉叛逃記,2022/10/21,天馬行空數位有限公司,MEMENTO INTERNATIONAL,2,32,433.33%,"5,020",748,"152,584"
33,日本,每天上班總是累得要死,2022/10/21,原創娛樂股份有限公司,Nikkatsu Corporation,1,26,420.00%,"4,160",390,"90,607"
34,日本,救救旱鴨子,2022/10/21,采昌國際多媒體股份有限公司,"Free Stone Productions Co., Ltd.",1,126,740.00%,"27,720","1,406","311,449"
35,巴勒斯坦,天堂髮廊,2022/10/21,東昊影業有限公司,Memento International,1,26,0.00%,"4,160",393,"83,411"
36,美國,黑亞當,2022/10/19,美商華納兄弟（遠東）股份有限公司台灣分公司,WARNER BROS. PICTURES INTERNATIONAL.,97,"20,694",-46.40%,"5,083,313","555,504","143,669,823"
37,美國,哥兒們,2022/10/19,美商美國環球影片股份有限公司台灣分公司,UNIVERSAL INTERNATIONAL FILMS LLC,40,610,-75.06%,"151,182","15,277","3,743,278"
38,日本,極速甩尾,2022/10/14,原創娛樂股份有限公司,Nikkatsu Corporation,1,16,-85.32%,"4,290","6,165","1,535,059"
39,美國,驚爆倒數60分鐘,2022/10/14,車庫娛樂股份有限公司,RELAY MOTION KFT.,1,128,"12,800.00%","28,160","4,146","921,637"
40,南韓,人生真美麗,2022/10/14,車庫娛樂股份有限公司,RELAY MOTION KFT.,2,5,-90.00%,"1,040","6,097","1,425,365"
41,中華民國,童話·世界,2022/10/13,主磐叙社有限公司,主磐叙社有限公司,2,52,-96.33%,"12,520","16,328","3,894,626"
42,中華民國,孫行者傳,2022/10/13,數位領域電影文化股份有限公司,數位領域電影文化股份有限公司,9,319,-89.43%,"50,570","6,639","1,336,285"
43,日本,麵包超人電影版：多洛林與妖怪嘉年華,2022/10/07,曼迪傳播有限公司,"TMS ENTERTAINMENT CO., LTD.",8,67,67.50%,"16,299","1,666","410,394"
44,美國,幸福入場券,2022/10/07,美商美國環球影片股份有限公司台灣分公司,UNIVERSAL INTERNATIONAL FILMS LLC,15,466,-54.31%,"108,780","68,024","16,945,474"
45,中華民國,你在我心上,2022/10/07,星勢力娛樂股份有限公司,"麻吉砥加電影有限公司,星勢力娛樂股份有限公司,艾婷投資股份有限公司",68,"3,681",-69.43%,"838,026","64,596","14,961,335"
46,日本,河畔小日子,2022/10/03,政駒實業有限公司,KADOKAWA CORPORATION,2,5,-87.50%,"1,010","1,701","383,353"
47,法國,小獅子王,2022/09/30,中影股份有限公司,PATHE FILMS S.A.S.,1,41,-43.06%,"9,545","2,607","588,892"
48,美國,微笑,2022/09/30,美商美國派拉蒙影片股份有限公司台灣分公司,PARAMOUNT PICTURES CORPORATION,15,331,-61.56%,"79,919","99,767","25,072,618"
49,美國,刀鋒劍客,2022/09/30,車庫娛樂股份有限公司,RELAY MOTION KFT.,2,14,-91.95%,"3,080","6,635","1,551,281"
50,南韓,樂透大作戰,2022/09/30,采昌國際多媒體股份有限公司,Atrium Productions Kft.,7,129,-60.55%,"28,132","75,243","18,392,725"
51,法國,正發生,2022/09/30,好威映象有限公司,Wild Bunch International,3,38,-71.64%,"8,000","4,044","918,201"
52,比利時,怪胎英雄：奇克探險記,2022/09/23,木棉花國際股份有限公司,NWAVE PICTURES,1,45,200.00%,"10,260","4,823","1,129,732"
53,法國,拆彈倒數30分鐘,2022/09/23,仲業股份有限公司,wide,2,144,300.00%,"14,220","2,139","439,076"
54,美國,別擔心親愛的,2022/09/16,美商華納兄弟（遠東）股份有限公司台灣分公司,WARNER BROS. PICTURES INTERNATIONAL.,3,144,0.00%,"13,079","17,696","4,300,461"
55,美國,看你往哪跑,2022/09/16,博偉電影股份有限公司,"BUENA VISTA INTERNATIONAL, INC.",1,63,-47.50%,"3,465","14,928","3,657,057"
56,日本,電影版 搖曳露營△,2022/09/16,薩摩亞商羚邦(亞洲)有限公司台灣分公司,FURYU CORPORATION,2,16,-71.93%,"4,140","30,065","7,630,245"
57,中華民國,科學少女,2022/09/16,華影國際影藝有限公司,"東海大學,東吳大學,國立台灣師範大學,社團法人中華民國大渡山學會",3,227,-76.43%,"56,305","32,710","7,523,021"
58,中華民國,兜兜風,2022/09/16,月晴映像有限公司,"月晴映像有限公司,寒山拾得有限公司,高雄人",1,80,0.00%,"17,600","4,510","1,013,475"
59,日本,新‧超人力霸王,2022/09/13,野獸國股份有限公司,TSUBURAYA PRODUCTIONS,17,404,42.25%,"100,153","39,160","10,036,995"
60,南韓,語意錯誤電影版,2022/09/08,采昌國際多媒體股份有限公司,ATRIUM PRODUCTIONS KFT,1,27,-10.00%,"6,375","31,503","8,099,320"
61,美國,拉辛正傳,2022/09/08,美商美國派拉蒙影片股份有限公司台灣分公司,PARAMOUNT PICTURES CORPORATION,3,134,-45.31%,"16,290","19,573","4,639,096"
62,義大利,請為我在羅馬多留一天,2022/09/08,海鵬影業有限公司,VISION DISTRIBUTION S.p.A.,1,178,64.81%,"20,430","1,693","327,024"
63,日本,七五計劃,2022/09/08,天馬行空數位有限公司,URBAN SALES. s.a.s (“US”),1,29,11.54%,"4,640","2,106","452,241"
64,日本,劇場版 超時空要塞F~虛空歌姬~,2022/09/07,水元素文化傳媒有限公司,"BIGWEST CO., LTD.",4,131,0.00%,"29,795","4,109","1,035,351"
65,香港,花樣年華 4K數位修復版,2022/09/03,英屬蓋曼群島商威望國際娛樂股份有限公司台灣分公司,"Jet Tone Films Limited,春光映畫,PARADIS FILMS",1,66,-58.75%,"14,735","14,494","3,636,734"
66,中華民國,他還年輕,2022/09/02,目宿媒體股份有限公司,目宿媒體股份有限公司,1,130,0.00%,"27,300","11,196","2,453,462"
67,美國,世紀婚魘,2022/09/02,美商台灣索尼影業發行股份有限公司台灣分公司,SONY PICTURES RELEASING INTERNATIONAL CORPORATION.,1,40,-25.93%,"2,200","12,325","2,884,044"
68,香港,媽的星寵兒,2022/09/02,英屬維京群島商高捷全球開發有限公司 台灣分公司,"英皇影業有限公司 , 英皇娛樂(香港)有限公司 , 香港電影發展基金",1,19,-58.70%,"3,040","1,848","449,863"
69,南韓,獵首密令,2022/08/26,英屬維京群島商高捷全球開發有限公司 台灣分公司,"MegaboxJoongang, Inc, PlusM.",2,142,343.75%,"20,000","34,224","8,195,776"
70,波蘭,大獲拳勝,2022/08/26,燕翼企業有限公司,LOCO FILMS,1,144,148.28%,"16,440","1,189","231,336"
71,美國,孤兒怨2：最黑暗的過去,2022/08/26,寶嘉租賃股份有限公司,"FILM,TV HOUSE LIMITED",1,32,0.00%,"3,870","75,751","18,745,490"
72,日本,北齋：浮世繪傳奇,2022/08/26,傳影互動股份有限公司,SDP INC.,1,28,-26.32%,"4,480","6,335","1,393,031"
73,日本,劇場版 五等分的新娘,2022/08/26,車庫娛樂股份有限公司,RELAY MOTION KFT.,1,6,-50.00%,"1,430","28,843","7,253,566"
74,美國,探戈行不行,2022/08/26,春暉映像有限公司,"Vision Films,Inc",2,21,-65.57%,"1,665","1,062","192,439"
75,中華民國,初戀慢半拍,2022/08/24,香港商甲上娛樂有限公司台灣分公司,"台灣大哥大股份有限公司 ,台北真好電影股份有限公司 ,良人行影業有限公司 ,宏將影業有限公司 ,時創影業股份有限公司,得利影視股份有限公司 ,聚星文創娛樂事業股份有限公司,喜滿客京華影城股份有限公司 ,威威巖娛樂製作有限公司 ,奇幻娛樂國際股份有限公司",1,38,46.15%,"6,080","31,530","7,576,889"
76,香港,神探大戰,2022/08/19,華映娛樂股份有限公司,"英皇影業有限公司, 英皇(北京)影視文化傳媒有限公司,北京上獅文化傳播有限公司,上海淘票票影視文化有限公司,華文映像(北京)影業有限公司",2,151,-47.20%,"10,395","19,738","4,404,479"
77,日本,航海王劇場版 : 紅髮歌姬,2022/08/13,薩摩亞商雄讚股份有限公司台灣分公司,TOEI ANIMATION ENTERPRISES LIMITED.,3,99,-49.23%,"24,285","660,265","175,270,417"
78,加拿大,沉默呼聲,2022/08/12,漂流木制作影視有限公司,Flying Clound Production Inc.,1,15,114.29%,"3,300","16,970","3,774,543"
79,日本,角落小夥伴電影版：藍色月夜的魔法之子,2022/08/05,威視股份有限公司,"ASMIK ACE,INC.",16,189,33.10%,"48,031","60,545","14,837,051"
80,日本,蠟筆小新：幽靈忍者珍風傳,2022/08/04,木棉花國際股份有限公司,ADK EMOTIOS INC.,2,61,-31.46%,"15,555","130,248","31,905,483"
81,美國,子彈列車,2022/08/03,美商台灣索尼影業發行股份有限公司台灣分公司,SONY PICTURES RELEASING INTERNATIONAL CORPORATION.,3,547,32.45%,"40,264","454,833","117,485,271"
82,法國,就在今夜,2022/07/29,東昊影業有限公司,MK2 Films,1,38,-11.63%,"4,517","1,665","357,078"
83,美國,小小兵2:格魯的崛起,2022/07/20,美商美國環球影片股份有限公司台灣分公司,UNIVERSAL INTERNATIONAL FILMS LLC,4,434,-10.14%,"58,500","597,226","147,160,567"
84,美國,超級救援狗,2022/07/10,豪華大戲院股份有限公司,IMAX Film Holding Co.,1,76,"7,600.00%","8,360",167,"18,075"
85,美國,深海獵奇,2022/07/09,豪華大戲院股份有限公司,IMAX Corporation.,1,40,11.11%,"4,400",211,"23,070"
86,美國,雷神索爾：愛與雷霆,2022/07/06,台灣華特迪士尼股份有限公司,"BUENA VISTA INTERNATIONAL,INC.",1,65,-56.38%,"3,575","862,935","225,302,482"
87,美國,最後的冰川,2022/07/02,豪華大戲院股份有限公司,IMAX Corporation,1,2,0.00%,155,166,"13,010"
88,日本,名偵探柯南 萬聖節的新娘,2022/06/30,普威爾國際股份有限公司,株式会社トムス・エンタテインメント,3,34,-58.02%,"8,515","481,360","121,010,660"
89,法國,藍色是最溫暖的顏色,2022/05/27,車庫娛樂股份有限公司,RELAY MOTION KFT.,1,1,0.00%,240,448,"108,949"
90,美國,捍衛戰士: 獨行俠,2022/05/23,美商美國派拉蒙影片股份有限公司台灣分公司,PARAMOUNT PICTURES CORPORATION,3,149,-50.33%,"27,070","2,675,622","732,112,023"
91,日本,劇場版 歌之☆王子殿下♪真愛KINGDOM,2019/06/14,曼迪傳播有限公司,KING RECORD COMPANY LIMITED,1,0,0.00%,0,"10,804","2,819,486"
92,美國,2001太空漫遊,2018/06/04,美商華納兄弟（遠東）股份有限公司台灣分公司,WARNER BROS. PICTURES INTERNATIONAL.,1,0,0.00%,0,"8,425","2,117,645"
93,美國,以你的名字呼喚我,2018/01/12,博偉電影股份有限公司,SONY PICTURES RELEASING INTERNATIONAL CORPORATION.,1,5,-64.29%,"1,550","33,046","7,756,329"
94,法國,玩命光頭,2016/11/04,原創娛樂股份有限公司,OTHER ANGLE PICTURES,1,1,-99.26%,240,"1,707","321,696"
95,中華民國,無岸之河,2015/12/18,目宿媒體股份有限公司,目宿媒體股份有限公司,3,8,-71.43%,"2,220",36,"8,445"
96,中華民國,不老騎士-歐兜邁環台日記,2012/10/12,視納華仁文化傳播股份有限公司,"財團法人弘道老人福利基金會 ,旋轉牧馬工作室,視納華仁文化傳播股份有限公司",1,112,0.00%,"28,000",503,"149,210"
97,日本,神隱少女,2001/12/28,香港商甲上娛樂有限公司台灣分公司,Studio Ghibli Inc.,1,25,0.00%,"5,450","65,584","16,258,900"
